{
  "id": "daily-order-A-001",
  "gameId": "daily-order",
  "seed": "order-A-001",
  "difficulty": {
    "stepCount": 2,
    "distractorCount": 0,
    "causalDistance": 0,
    "verbalSupport": "full"
  },
  "contentPack": "routines",
  "successRule": {
    "kind": "ordered_sequence"
  },
  "hintPolicy": {
    "afterErrors": 1,
    "maxHints": 2
  },
  "frustrationPolicy": {
    "simplifyAfterErrors": 2,
    "endOnDistress": true
  }
}
